{
  "schemaVersion": "1.0.0",
  "outcome": "verified",
  "verifiedAt": "2026-08-25T18:10:00Z",
  "deploymentId": "ensv2-sepolia-2026-07-30",
  "chain": "eip155:11155111",
  "name": {
    "input": "alice.eth",
    "normalized": "alice.eth",
    "labelhash": "0x0000000000000000000000000000000000000000000000000000000000000022",
    "namehash": "0x0000000000000000000000000000000000000000000000000000000000000023"
  },
  "canonicality": {
    "registryMatchesManifest": true,
    "observedRegistry": "0x00000000000000000000000000000000000000bd",
    "universalResolver": "0x00000000000000000000000000000000000000ee"
  },
  "ens": {
    "registered": true,
    "owner": "0x00000000000000000000000000000000000000a1",
    "expectedOwner": "0x00000000000000000000000000000000000000a1",
    "ownerMatches": true,
    "resolver": "0x00000000000000000000000000000000000000de",
    "forwardAddress": "0x00000000000000000000000000000000000000a1",
    "forwardResolutionMatches": true,
    "expiry": 1819236000,
    "currentTokenId": "7788990011"
  },
  "checks": [
    {
      "id": "registry-canonical",
      "description": "UR findCanonicalRegistry matches the manifest",
      "expected": "0x00000000000000000000000000000000000000bd",
      "actual": "0x00000000000000000000000000000000000000bd",
      "passed": true,
      "severity": "required"
    },
    {
      "id": "owner-matches",
      "description": "final owner equals the intent owner",
      "expected": "0x00000000000000000000000000000000000000a1",
      "actual": "0x00000000000000000000000000000000000000a1",
      "passed": true,
      "severity": "required"
    },
    {
      "id": "forward-resolution",
      "description": "name forward-resolves to the owner through the UR",
      "expected": "0x00000000000000000000000000000000000000a1",
      "actual": "0x00000000000000000000000000000000000000a1",
      "passed": true,
      "severity": "required"
    }
  ],
  "evidenceSource": {
    "rpcEndpointCount": 2,
    "endpointsAgree": true,
    "blockNumber": 9123460,
    "providerAssertionsUsed": false
  },
  "custody": {
    "mode": "direct",
    "transferRequired": false,
    "transferCompleted": true,
    "finalOwnerIsIntendedOwner": true
  }
}
